{
  "schema_version": 1,
  "app_min_schema_version": 1,
  "data_version": "2026-05-29",
  "content_review_cadence": "quarterly",
  "profile_flags": [
    { "id": "moving",                            "label_ko": "이사 진행 중",                "label_ja": "引っ越し中" },
    { "id": "jobchange",                         "label_ko": "이직 진행 중",                "label_ja": "転職中" },
    { "id": "has_job_gap",                       "label_ko": "퇴직~입사 사이 공백 있음",    "label_ja": "退職と入社の間に空白あり" },
    { "id": "has_company_dc_or_ideco",           "label_ko": "企業型DC 또는 iDeCo 가입",    "label_ja": "企業型DC・iDeCo加入" },
    { "id": "has_side_income_or_freelance",      "label_ko": "부업/프리랜서 소득 있음",     "label_ja": "副業・フリーランス収入あり" },
    { "id": "spouse_dependent_or_dependent_visa","label_ko": "배우자 부양 또는 가족체류비자","label_ja": "配偶者扶養または家族滞在ビザ" },
    { "id": "leaving_japan_or_overseas_move",    "label_ko": "영구 귀국/제3국 이동 가능성", "label_ja": "永久帰国・第三国移動の可能性" },
    { "id": "has_drivers_license",               "label_ko": "운전면허 보유",               "label_ja": "運転免許所持" },
    { "id": "has_car",                           "label_ko": "자동차 보유",                 "label_ja": "自動車所持" },
    { "id": "has_private_health_ins",            "label_ko": "민간 의료보험 가입",          "label_ja": "民間医療保険加入" },
    { "id": "has_life_ins",                      "label_ko": "생명보험 가입",               "label_ja": "生命保険加入" },
    { "id": "has_kids",                          "label_ko": "자녀 동반",                   "label_ja": "子供同伴" },
    { "id": "has_spouse",                        "label_ko": "배우자 동반",                 "label_ja": "配偶者同伴" },
    { "id": "visa_change_needed",                "label_ko": "이직으로 비자/소속기관 변경", "label_ja": "在留資格・所属機関の変更" }
  ],
  "categories": [
    {
      "id": "cat_moving",
      "icon": "📦",
      "label_ko": "이사",
      "label_ja": "引っ越し",
      "visible_when": { "any_of": ["moving"] },
      "subcategories": [
        {
          "id": "cat_moving_decide",
          "label_ko": "결정·계약",
          "label_ja": "決定・契約",
          "items": [
            {
              "id": "mv_decide_compare_001",
              "title_ko": "새 집 후보 비교·내람",
              "title_ja": "賃貸物件の比較・内見",
              "description_ko": "지역·예산을 정하고 부동산 사이트·중개업소로 물건을 비교·내람(内見)합니다. 초기비용(敷金·礼金·仲介手数料)도 함께 확인하세요.",
              "timeline": "D-60", "timeline_offset_days": -60,
              "tags": ["계약"], "risk_level": "convenience",
              "visible_when": {}, "sources": [], "last_verified": "2026-05-29", "needs_verification": false, "links": []
            },
            {
              "id": "mv_decide_cancel_notice_001",
              "title_ko": "현재 집 해약 통지 (解約通知)",
              "title_ja": "現賃貸物件の解約通知",
              "description_ko": "해약 통지는 보통 퇴거 1개월 전(계약서에 따라 2개월 전)까지 집주인·관리회사에 해야 합니다. 늦으면 그만큼 월세를 더 내므로 계약서의 통지 기간(予告期間)을 반드시 확인하세요.",
              "timeline": "D-45", "timeline_offset_days": -45,
              "tags": ["계약", "금전"], "risk_level": "money_loss",
              "visible_when": {},
              "sources": [
                { "label_ko": "민법 제617조 (임대차 해지 통지)", "url": "https://laws.e-gov.go.jp/law/129AC0000000089", "publisher": "e-Gov法令検索", "last_verified": "2026-05-29" }
              ],
              "last_verified": "2026-05-29", "needs_verification": false, "links": []
            },
            {
              "id": "mv_decide_mover_quote_001",
              "title_ko": "이사업체 견적·예약",
              "title_ja": "引越し業者の見積り・予約",
              "description_ko": "여러 업체 견적(見積り)을 비교·예약합니다. 3~4월 성수기(繁忙期)는 요금이 급등하고 예약이 빨리 차므로 미리 잡으세요.",
              "timeline": "D-30", "timeline_offset_days": -30,
              "tags": ["계약"], "risk_level": "convenience",
              "visible_when": {}, "sources": [], "last_verified": "2026-05-29", "needs_verification": false, "links": []
            }
          ]
        },
        {
          "id": "cat_moving_prepare",
          "label_ko": "이사 전 준비",
          "label_ja": "引っ越し前",
          "items": [
            {
              "id": "mv_prep_internet_001",
              "title_ko": "인터넷 회선 이전 수속",
              "title_ja": "インターネット回線の移転手続き",
              "description_ko": "광회선(光回線) 이전·신규는 개통 공사에 수주가 걸릴 수 있어 이사 2~4주 전 신청을 권장합니다. 신축·다른 사업자 지역은 위약금·공사비가 생길 수 있습니다.",
              "timeline": "D-21", "timeline_offset_days": -21,
              "tags": ["통신"], "risk_level": "convenience",
              "visible_when": {}, "sources": [], "last_verified": "2026-05-29", "needs_verification": true, "links": []
            },
            {
              "id": "mv_prep_lifeline_001",
              "title_ko": "전기·가스·수도 이전 수속",
              "title_ja": "電気・ガス・水道の移転手続き",
              "description_ko": "현재 거주지 사용 정지(使用停止)와 새 거주지 사용 개시(使用開始)를 신청합니다. 특히 가스 개통(開栓)은 입회(立会い)가 필요해 미리 일정 예약이 필수입니다.",
              "timeline": "D-14", "timeline_offset_days": -14,
              "tags": ["생활"], "risk_level": "service_interruption",
              "visible_when": {}, "sources": [], "last_verified": "2026-05-29", "needs_verification": false, "links": []
            },
            {
              "id": "mv_prep_sodai_gomi_001",
              "title_ko": "대형쓰레기·불용품 처분",
              "title_ja": "粗大ごみ・不用品の処分",
              "description_ko": "대형쓰레기(粗大ごみ)는 지자체 접수센터에 사전 예약 후 처리권(処理券)을 사서 배출합니다. 수거까지 수일~수주 걸릴 수 있어 조기 예약 권장. 에어컨·TV·냉장고·세탁기는 가전리사이클법(家電リサイクル法) 대상으로 별도 처리합니다.",
              "timeline": "D-14", "timeline_offset_days": -14,
              "tags": ["생활"], "risk_level": "convenience",
              "visible_when": {},
              "sources": [
                { "label_ko": "가전리사이클법 안내", "url": "https://www.env.go.jp/recycle/kaden/", "publisher": "環境省", "last_verified": "2026-05-29" }
              ],
              "last_verified": "2026-05-29", "needs_verification": false, "links": []
            },
            {
              "id": "mv_prep_mail_forward_001",
              "title_ko": "우편물 전송 신청 (転居・転送サービス)",
              "title_ja": "郵便物の転送サービス（e転居）",
              "description_ko": "일본우편의 전거·전송 서비스를 신청하면 옛 주소로 온 우편물을 1년간 새 주소로 무료 전송합니다. 온라인(e転居)으로도 신청할 수 있습니다.",
              "timeline": "D-7", "timeline_offset_days": -7,
              "tags": ["생활"], "risk_level": "convenience",
              "visible_when": {},
              "sources": [
                { "label_ko": "전거·전송 서비스", "url": "https://www.post.japanpost.jp/service/tenkyo/", "publisher": "日本郵便", "last_verified": "2026-05-29" }
              ],
              "last_verified": "2026-05-29", "needs_verification": false, "links": []
            }
          ]
        },
        {
          "id": "cat_moving_dday",
          "label_ko": "이사 당일",
          "label_ja": "引っ越し当日",
          "items": [
            {
              "id": "mv_dday_move_out_001",
              "title_ko": "구 거주지 가스 폐전·퇴거 입회",
              "title_ja": "旧居のガス閉栓・退去立会い",
              "description_ko": "가스 폐전(閉栓)에 입회가 필요한 경우가 있고, 임대주택은 관리회사와의 퇴거 입회(退去立会い)에서 원상복구·실내 상태를 확인하고 열쇠를 반납합니다. 이때 敷金(보증금) 정산 내역을 확인하세요.",
              "timeline": "D-Day", "timeline_offset_days": 0,
              "tags": ["생활"], "risk_level": "service_interruption",
              "visible_when": {}, "sources": [], "last_verified": "2026-05-29", "needs_verification": false, "links": []
            },
            {
              "id": "mv_dday_utility_start_001",
              "title_ko": "새 거주지 전기·수도·가스 사용 개시",
              "title_ja": "新居の電気・水道・ガス使用開始",
              "description_ko": "차단기(ブレーカー)·수도 밸브를 켜고, 사전 예약한 가스 개통(開栓) 입회를 진행합니다. 가스는 입회 없이는 사용할 수 없습니다.",
              "timeline": "D-Day", "timeline_offset_days": 0,
              "tags": ["생활"], "risk_level": "service_interruption",
              "visible_when": {}, "sources": [], "last_verified": "2026-05-29", "needs_verification": false, "links": []
            },
            {
              "id": "mv_dday_baggage_check_001",
              "title_ko": "이삿짐 인수·파손 확인",
              "title_ja": "荷物の受け取り・破損確認",
              "description_ko": "짐 개수와 가구·가전 파손 여부를 그 자리에서 확인합니다. 운송 중 파손은 표준 이사 운송 약관상 기한 내(통상 인도 후 3개월 이내)에 업체에 통지해야 보상받을 수 있으니 즉시 확인·신고하세요.",
              "timeline": "D-Day", "timeline_offset_days": 0,
              "tags": ["금전"], "risk_level": "money_loss",
              "visible_when": {},
              "sources": [
                { "label_ko": "표준 이사 운송 약관", "url": "https://www.mlit.go.jp/jidosha/jidosha_tk2_000020.html", "publisher": "国土交通省", "last_verified": "2026-05-29" }
              ],
              "last_verified": "2026-05-29", "needs_verification": false, "links": []
            }
          ]
        },
        {
          "id": "cat_moving_after",
          "label_ko": "이사 후 (직장·기타)",
          "label_ja": "引っ越し後（勤務先など）",
          "items": [
            {
              "id": "mv_after_company_addr_001",
              "title_ko": "회사·학교에 주소 변경 신고",
              "title_ja": "勤務先・学校への住所変更届出",
              "description_ko": "근무처에 주소 변경을 신고합니다. 통근수당(通勤手当)·연말정산·사회보험 주소 갱신과 연관되므로 빠르게 처리하세요.",
              "timeline": "D+7", "timeline_offset_days": 7,
              "tags": ["생활"], "risk_level": "convenience",
              "visible_when": {}, "sources": [], "last_verified": "2026-05-29", "needs_verification": false, "links": []
            }
          ]
        }
      ]
    },
    {
      "id": "cat_jobchange",
      "icon": "💼",
      "label_ko": "이직",
      "label_ja": "転職",
      "visible_when": { "any_of": ["jobchange"] },
      "subcategories": [
        {
          "id": "cat_jc_offer",
          "label_ko": "의사결정·오퍼",
          "label_ja": "意思決定・オファー",
          "items": [
            {
              "id": "jc_offer_visa_fit_001",
              "title_ko": "오퍼 직무와 재류자격(在留資格) 적합성 확인",
              "title_ja": "オファー内容と在留資格の適合性を確認",
              "description_ko": "새 회사 업무가 현 재류자격(예: 技術・人文知識・国際業務)의 활동 범위에 맞는지 확인하세요. 직종이 크게 달라지면 별도 허가가 필요할 수 있습니다.",
              "timeline": "D-30", "timeline_offset_days": -30,
              "tags": ["비자"], "risk_level": "service_interruption",
              "visible_when": { "any_of": ["visa_change_needed"] },